NAME,LCITY,LAT,LON,TYPE
Bright Horizons Children's Center Inc.,Bethel,41.425621,-73.396351,daycare
Fun Steps Preschool Child Care Ctr,Bethel,41.397111,-73.401462,daycare
Gingerbread School House,Bethel,41.391781,-73.386731,daycare
Kindercare Learning Centerinc #1381,Bethel,41.412841,-73.380292,daycare
Little Friends Pre-school Llc,Bethel,41.38237,-73.417961,daycare
Precious Moments Day Care Ctr Inc,Bethel,41.39192,-73.382161,daycare
The Sandbox Day Care Center Of Bethel Llc,Bethel,41.3712793,-73.40756592,daycare
Village Pre-school,Bethel,41.37115,-73.412192,daycare
Ymca Children's Center,Bethel,41.3737,-73.423852,daycare
Brookfield School Age Child Care,Brookfield,41.44798347,-73.41854727,daycare
Christian Life Academy,Brookfield,41.45542,-73.401332,daycare
Country Kids Club,Brookfield,41.43904,-73.405451,daycare
Country Kids Play Farm Inc,Brookfield,41.4399,-73.405262,daycare
Greenknoll Children's Center,Brookfield,41.45229,-73.402962,daycare
Greenknoll Children's Center Annex Unit I-e,Brookfield,41.45402,-73.402932,daycare
Kids Castle Child Care Learning Center,Brookfield,41.479891,-73.408922,daycare
Montessori Community School At,Brookfield,41.44084,-73.379262,daycare
The Goddard School,Brookfield,41.49221,-73.418751,daycare
Action Early Learning Center,Danbury,41.40343,-73.455442,daycare
Best Friends Preschool,Danbury,41.37992,-73.444962,daycare
Cedargables Pre-school Llc,Danbury,41.43314,-73.493677,daycare
Children's Choice Inc.,Danbury,41.367186,-73.479437,daycare
Cifc/hsnfc School Readiness Program,Danbury,41.391001,-73.448792,daycare
Danbury Even Start Early Learning Center,Danbury,41.387688,-73.480505,daycare
Danbury Public School Child Care Prog,Danbury,41.395008,-73.465112,daycare
Hats Off To Kids Llc,Danbury,41.408773,-73.46745,daycare
Head Start Of Northern Fairfield Cty Lrl,Danbury,41.401099,-73.458591,daycare
Hudson Country Montessori School,Danbury,41.390444,-73.430295,daycare
Interfaith Early Learning Center,Danbury,41.404501,-73.440392,daycare
Kindercare Learning Ctr Inc #755,Danbury,41.42088,-73.499082,daycare
King Street Nursery School Inc.,Danbury,41.428912,-73.506301,daycare
Little People Learning Center Llc,Danbury,41.399987,-73.43494,daycare
Little Rascals Nursery School Inc,Danbury,41.43633,-73.478101,daycare
Mill Ridge School Readiness Program,Danbury,41.387688,-73.480505,daycare
New England Country Day School Inc.,Danbury,41.378927,-73.494422,daycare
Right Place,Danbury,41.390959,-73.451433,daycare
Sandbox Day Care Center Llc,Danbury,41.444461,-73.426522,daycare
Sandbox Too!,Danbury,41.37703,-73.463962,daycare
Wee Wisdom Child Care Center Fed.corrct.inst-l.sipe Bldg-rt,Danbury,41.3756,-73.4596,daycare
West Side Children's Center,Danbury,41.378561,-73.464002,daycare
Western Ct State University Child Care Ctr,Danbury,41.4006,-73.444511,daycare
First Cong Church Darien Nursery School,Darien,41.081471,-73.465221,daycare
Holly Pond School,Darien,41.05856,-73.498631,daycare
Methodist Family Center Preschool Inc.,Darien,41.083926,-73.48593,daycare
Noroton Presbyterian Church Tot Drop,Darien,41.06018,-73.488072,daycare
Our Gang Nursery School,Darien,41.0849,-73.458821,daycare
St. John Pre School,Darien,41.060451,-73.487151,daycare
St. Luke's Parish School,Darien,41.061425,-73.48407,daycare
St. Thomas More Happiness Preschool,Darien,41.086501,-73.485691,daycare
Banksville Nursery School,Greenwich,41.05835,-73.658709,daycare
Bridges School- Amherst Program,Riverside,41.050051,-73.572071,daycare
Chabad Gan Of Greenwich,Greenwich,41.0298,-73.624501,daycare
Children's Day School Inc.,Greenwich,41.037501,-73.664017,daycare
Children's Day School Inc.,Riverside,41.040301,-73.586462,daycare
Christ Church Nursery School,Greenwich,41.03190073,-73.6193233,daycare
Cos Cob Play Group,Cos cob,41.03975381,-73.59805656,daycare
Family Centers Preschool,Greenwich,41.02341643,-73.62789992,daycare
First Church Preschool,Old greenwich,41.03661251,-73.5687205,daycare
First Presbyterian Church Nur Sch,Greenwich,41.03153379,-73.62829329,daycare
Gateway School,Greenwich,41.01541397,-73.65196618,daycare
Glenville Child Care Inc. At Wms,Greenwich,41.01039,-73.648759,daycare
Greenwich Family Ymca @ New Lebanon,Greenwich,41.0015,-73.656022,daycare
Greenwich Family Ymca Child Care,Greenwich,41.01757035,-73.63981683,daycare
Greenwich Kokusai Garkuen/wideworld,Cos cob,41.041292,-73.592738,daycare
International School Child Care,Old greenwich,41.034683,-73.567051,daycare
Joan Melber Warburg Early Childhood,Greenwich,41.0217744,-73.63323826,daycare
Little Friends,Greenwich,41.02024485,-73.64472937,daycare
Mencius Mandarin Preschool,Greenwich,41.036651,-73.604321,daycare
North Greenwich Nursery School,Greenwich,41.09575085,-73.68959008,daycare
Old Greenwich School Child Care,Old greenwich,41.02949653,-73.5676233,daycare
Pat-a-cake Playschool Inc.,Greenwich,41.00666853,-73.65395772,daycare
Putnam-indian Field School Inc,Greenwich,41.025599,-73.605488,daycare
Round Hill Nur Sch Inc 'first Step',Greenwich,41.09555191,-73.66615761,daycare
Round Hill Nursery School,Greenwich,41.1053844,-73.66860802,daycare
Selma Maisel Nursery School,Greenwich,41.03597979,-73.61710508,daycare
St Paul's Day School,Riverside,41.027301,-73.584271,daycare
St. Saviour's Church Nrsry Sch,Old greenwich,41.024181,-73.565782,daycare
The Learning Garden Christian Preschool,Greenwich,41.08215611,-73.71168879,daycare
The Preschool @ Second Congregational,Greenwich,41.03553421,-73.62315787,daycare
Tiny Tots' School,Riverside,41.034071,-73.587911,daycare
Ymca Greenwich Child Care@ North Mianus,Riverside,41.057701,-73.580851,daycare
Ywca Child Care Center,Greenwich,41.03831321,-73.61841275,daycare
Beginner's Nature Program,New canaan,41.153663,-73.4995,daycare
Beginner's Nature Program--annex,New canaan,41.153663,-73.4995,daycare
Day Care Center Of New Canaan Inc,New canaan,41.141392,-73.491369,daycare
First Presbyterian Nrsry Sch,New canaan,41.154611,-73.499944,daycare
New Canaan Community Nursery School,New canaan,41.136889,-73.47721,daycare
New Canaan Ymca Child Development Center,New canaan,41.129454,-73.486525,daycare
Playland Nursery School - Brown,New canaan,41.139669,-73.527446,daycare
Playland Nursery School - Redwood,New canaan,41.139669,-73.527446,daycare
Playland Nursery School - White,New canaan,41.139669,-73.527446,daycare
St Mark's Nursery School,New canaan,41.151454,-73.498336,daycare
The Tot's Spot,New canaan,41.135064,-73.49675,daycare
Toddler Time To Five,New canaan,41.148667,-73.495761,daycare
United Methodist Church Nrsry School,New canaan,41.141136,-73.491417,daycare
Christian Day Nursery School,Danbury,41.391612,-73.453537,daycare
Beehive Children's Center Inc.,New milford,41.53932,-73.422131,daycare
Children's Center Of New Milford Inc,New milford,41.581709,-73.41259,daycare
Education Center Of United Methodist,New milford,41.56507,-73.414832,daycare
For Children Only Inc.,New milford,41.544811,-73.413092,daycare
Holy Infant Nursery School,New milford,41.58059,-73.411391,daycare
Kinder Care Learning Center,New milford,41.54645,-73.420532,daycare
Litchfield County Head Start-hill & Plain,New milford,41.53444,-73.429692,daycare
Litchfield County Head Start-pettibone,New milford,41.56346,-73.411572,daycare
Little People N.s. First Assembly Of God,New milford,41.601591,-73.403322,daycare
Tia's Country Day Care & School,New milford,41.599831,-73.403862,daycare
Time For Children,New milford,41.600691,-73.406782,daycare
Top Flight Sports Center Preschool,New milford,41.563621,-73.411822,daycare
Wow Kids Learning Center And Child Care,New milford,41.5039,-73.418442,daycare
Housatonic Valley Waldorf Schl Early,Newtown,41.378557,-73.354368,daycare
A Kid's Place Inc.,Norwalk,41.103351,-73.427131,daycare
All Saints Daycare,Norwalk,41.13621,-73.414982,daycare
Busy Bodies Child Care Center Inc.,Norwalk,41.153611,-73.412662,daycare
Carousel Preschool Day Nursery Inc,Norwalk,41.123823,-73.409933,daycare
Carver After School Program For,Norwalk,41.11382,-73.413492,daycare
Children's Playhouse,Norwalk,41.08645,-73.429732,daycare
Columbus Magnet School,Norwalk,41.093461,-73.420441,daycare
Community Co-op Nrsry Sch Inc.,Norwalk,41.0751,-73.430172,daycare
Cranbury Elementary School,Norwalk,41.155383,-73.403367,daycare
Five Mile River Nursery School,Norwalk,41.069598,-73.442509,daycare
Fox Run Elementary School,Norwalk,41.114951,-73.454242,daycare
Growing Seeds Child Development Center,Norwalk,41.099971,-73.422461,daycare
Happy Time Nursery School,Norwalk,41.133176,-73.4526,daycare
L'il Critters Preschool Inc.,Norwalk,41.119738,-73.408251,daycare
Marvin Children's Center,Norwalk,41.097861,-73.400171,daycare
Naramake Family Resource Center Inc.,Norwalk,41.119271,-73.391341,daycare
Neon At Ben Franklin,Norwalk,41.09778,-73.424801,daycare
Nitzan Nursery School,Norwalk,41.11463,-73.407671,daycare
Norwalk Comm Child Development,Norwalk,41.1016,-73.451321,daycare
Ponus Ridge @ Middle School,Norwalk,41.122061,-73.431708,daycare
Room To Grow,Norwalk,41.10567,-73.405012,daycare
Safe & Sound Day Care Ii,Norwalk,41.094221,-73.434522,daycare
Silvermine School,Norwalk,41.14797,-73.440311,daycare
Sonshine Christian Children's Center,Norwalk,41.115494,-73.415064,daycare
The Center Day Care,Norwalk,41.156971,-73.422202,daycare
The Children's Playhouse Inc.,Norwalk,41.103111,-73.419861,daycare
The Clover Hill School Inc.,Norwalk,41.102831,-73.402341,daycare
Toni's Day Care,Norwalk,41.120311,-73.405671,daycare
Tracey Elementary School,Norwalk,41.12422,-73.413984,daycare
Tumble Bugs Day School,Norwalk,41.136171,-73.401471,daycare
Tutor Time Child Care Learning Center,Norwalk,41.150619,-73.425144,daycare
United Church Nursery School,Norwalk,41.07143,-73.444002,daycare
West Norwalk Nursery School,Norwalk,41.113401,-73.453492,daycare
West Rocks Middle School,Norwalk,41.13484,-73.414302,daycare
Ymca Of Norwalk Inc. Little Wonders,Norwalk,41.1114,-73.416901,daycare
Kid's Time Preschool & Daycare Inc.,Redding,41.26073,-73.429272,daycare
Montessori School Of Redding Llc,Redding center,41.30721,-73.38244,daycare
Pinewood Learning Center,Redding,41.314111,-73.464331,daycare
All For Kids,Ridgefield,41.314911,-73.472892,daycare
Almost Home,Ridgefield,41.295437,-73.495203,daycare
Apple Blossom Children's Center,Ridgefield,41.37526,-73.526189,daycare
Children's Corner Inc.,Ridgefield,41.323848,-73.510459,daycare
Creative Children's Korner Inc.,Ridgefield,41.2662,-73.525792,daycare
Jesse Lee Day School,Ridgefield,41.27559,-73.497531,daycare
Kaleidoscope Kids,Ridgefield,41.361015,-73.524635,daycare
My Nursery School,Ridgefield,41.31281,-73.514801,daycare
Ridgefield Community Kindergarten,Ridgefield,41.278645,-73.497999,daycare
Ridgefield Montessori School,Ridgefield,41.292111,-73.493502,daycare
St. Stephen's Nursery School,Ridgefield,41.279575,-73.498305,daycare
Sherman Nursery School,Sherman,41.598121,-73.496171,daycare
All About Kids Inc.,Stamford,41.05657,-73.506512,daycare
Art Nature & Me @ Stamford Museum &,Stamford,41.123641,-73.545692,daycare
Baby Cottage Ii,Stamford,41.096414,-73.519834,daycare
Baby Cottage Inc.,Stamford,41.09781,-73.531551,daycare
Bright Horizons @ High Ridge Park,Stamford,41.112074,-73.544099,daycare
Bright Minds,Stamford,41.056931,-73.536943,daycare
Brookdale Nursery School,Stamford,41.132998,-73.546691,daycare
Canaan Ridge School Inc,Stamford,41.157341,-73.596301,daycare
Chester Addison Child Development Center,Stamford,41.04149796,-73.55736881,daycare
Chester Addison Comm Ctr Study Zone Asp,Stamford,41.04190865,-73.55752497,daycare
Creative Care Child Care,Stamford,41.056591,-73.543131,daycare
Cte After School Academy,Stamford,41.041911,-73.536682,daycare
Davco Activities Program,Stamford,41.103861,-73.530852,daycare
First Presbyterian Church Nur Sch,Stamford,41.062801,-73.539701,daycare
First United Methodist Nursery School,Stamford,41.076981,-73.552581,daycare
Forest Street Child Development Center,Stamford,41.056931,-73.536943,daycare
Franklin Commons Child Development,Stamford,41.059441,-73.542212,daycare
Gan Yeladim Preschool,Stamford,41.097055,-73.54784,daycare
Glenbrook Comm Ctr Playschool,Stamford,41.070241,-73.518602,daycare
Gray Farms Nursery School,Stamford,41.08957,-73.534051,daycare
Hartco Activities Program,Stamford,41.057621,-73.547821,daycare
Italian Center Nursery School,Stamford,41.11522,-73.533951,daycare
J.c.c. Child Care Programs,Stamford,41.094061,-73.532012,daycare
Jeanne Hudgens Head Start Center,Stamford,41.059626,-73.520396,daycare
K.t. Murphy Community School,Stamford,41.04783,-73.510601,daycare
Lathon Wider Child Development Center,Stamford,41.044521,-73.538532,daycare
Lead Academy,Stamford,41.05246,-73.542221,daycare
Learning Center At Piper's Hill Inc.,Stamford,41.089051,-73.560802,daycare
Little Folks Playschool Llc,Stamford,41.114731,-73.530182,daycare
Long Ridge Child Development Center,Stamford,41.095361,-73.563491,daycare
Mark Of Excellence,Stamford,41.055221,-73.533712,daycare
Martin Luther King Preschool,Stamford,41.05127561,-73.54868627,daycare
Mother's Little Helper Ed. Day Care Inc.,Stamford,41.048086,-73.548831,daycare
Mrs. Bee's Learn And Play Llc,Stamford,41.08204,-73.521782,daycare
Newco Activities Program,Stamford,41.091237,-73.54057,daycare
Noah's Ark Nursery School,Stamford,41.059215,-73.527516,daycare
Northco Activities Program,Stamford,41.123971,-73.547631,daycare
Our Lady Of Grace Day Care Ctr,Stamford,41.074131,-73.517122,daycare
Palmers Hill Child Devlopment Center,Stamford,41.05918,-73.563072,daycare
Quamco Activities Program,Stamford,41.081797,-73.522989,daycare
Quintard Manor Head Start,Stamford,41.056151,-73.525812,daycare
Rogers Family Resource Child Care,Stamford,41.05327,-73.521442,daycare
Roxco Activities Program,Stamford,41.089078,-73.565009,daycare
Saint Ann's Nursery School,Stamford,41.058331,-73.551722,daycare
Shiny Little Stars,Stamford,41.08173,-73.533981,daycare
Springco Activities Program,Stamford,41.09684,-73.519931,daycare
Starkco Activities Program,Stamford,41.06668,-73.521701,daycare
Stillco Activities,Stamford,41.06879,-73.558081,daycare
Stillmeadow School Readiness Program,Stamford,41.06879,-73.558081,daycare
Ubs Child Development Center Redmen's Hall,Stamford,41.049499,-73.540755,daycare
Union Memorial Preschool,Stamford,41.071214,-73.521289,daycare
Villa Divino Amore Nursery School,Stamford,41.06478,-73.526451,daycare
Westco Activities Program,Stamford,41.057664,-73.55988,daycare
Westover School Readiness & Family,Stamford,41.057664,-73.55988,daycare
William Pitt Child Development Center,Stamford,41.063281,-73.527662,daycare
Yerwood Day Care Center,Stamford,41.04821344,-73.5506661,daycare
Yerwood Scholars After School Program,Stamford,41.048785,-73.551361,daycare
Emmanuel Nursery School,Weston,41.222891,-73.347502,daycare
Norfield Children's Center Inc.,Weston,41.202281,-73.377341,daycare
St. Francis Of Assisi Pre-school,Weston,41.200001,-73.383112,daycare
A Child's Place,Westport,41.127181,-73.345432,daycare
Children's Community Development Center,Westport,41.127181,-73.345432,daycare
Christ And Holy Trinity Church Day School,Westport,41.142393,-73.359796,daycare
Conservative Synagogue Preschool,Westport,41.133875,-73.343219,daycare
Earthplace Nursery School,Westport,41.144486,-73.379149,daycare
Learning Community Day Sch Inc,Westport,41.127181,-73.345432,daycare
Old Hill Children's Day School Llc,Westport,41.150281,-73.368611,daycare
Pumpkin Preschool Of Westport Inc.,Westport,41.137025,-73.367208,daycare
Saugatuck Nursery School Inc.,Westport,41.141261,-73.357481,daycare
St. Paul Christian School,Westport,41.170341,-73.351392,daycare
Temple Israel Early Childhood Center,Westport,41.177811,-73.355152,daycare
Three Four Open The Door Llc,Westport,41.166361,-73.381812,daycare
Westport Community Nursery School Inc,Westport,41.168421,-73.361231,daycare
Westport/weston Ymca Childcare,Westport,41.141448,-73.361134,daycare
Westport-weston Coop Nur Sch Inc,Westport,41.176288,-73.358369,daycare
Apple Blossom School And Family Center,Wilton,41.21737,-73.428452,daycare
Belden Hill Montessori Llc,Wilton,41.173071,-73.438662,daycare
Bright Horizons At Wilton,Wilton,41.192171,-73.432372,daycare
Children's Day School Of Wilton Inc.,Wilton,41.1975,-73.441452,daycare
Community Nursery School Of Wilton Inc.,Wilton,41.19334,-73.433272,daycare
Creative Play Llc,Wilton,41.262236,-73.437539,daycare
First Step Christian Day School,Wilton,41.176241,-73.436841,daycare
Helen Gander Friends Nursery School,Wilton,41.16575,-73.461121,daycare
Homespun Learning Environment Ltd,Wilton,41.21992,-73.427941,daycare
Leaps 'n Bounds Child Care Services Llc,Wilton,41.19735,-73.431432,daycare
Pandas Playmates,Wilton,41.211331,-73.432051,daycare
Town And Country Montessori School Inc.,Wilton,41.229361,-73.425551,daycare
Wilton Family Ymca Nursery School,Wilton,41.211331,-73.432051,daycare
Zion's Hill Preschool Program,Wilton,41.221061,-73.427201,daycare
Prince Of Peace Nursery School,Brookfield,41.45561,-73.399731,daycare
Noroton Presbyterian Nrsry Sch,Darien,41.06018,-73.488072,daycare
First Presbyterian Church Ns 2 Yr Old,Greenwich,41.03123192,-73.62802017,daycare
First Step Pre-school Inc. Ii,New fairfield,41.466543,-73.485289,daycare
New Fairfield Bright Beginnings Inc,New fairfield,41.456844,-73.477429,daycare
The Growing Tree Nursery School Llc,Ridgefield,41.283795,-73.495361,daycare
Little Munchkin Day Care Inc.,Sherman,41.57938,-73.495282,daycare
Bright Horizons Children's Center,Stamford,41.044324,-73.55137,daycare
Jewish Comm Ctr Sara Walker N.s. Temple Sinai,Stamford,41.123794,-73.535568,daycare
Rippowam Child Development Center,Stamford,41.052671,-73.56667,daycare
Falls Village Day Care Center,Falls village,41.96040364,-73.34802911,daycare
Puddle Jumpers Day Care Center Llc,Canaan,42.010006,-73.350342,daycare
Cornwall Child Center Inc.,West cornwall,41.876327,-73.340756,daycare
Kent Children's Center,Kent,41.730166,-73.472998,daycare
Kent Community Nursery School,Kent,41.724779,-73.477216,daycare
Kent School Early Learning Center Route,Kent,41.732612,-73.460607,daycare
Cynthia White Children's Center,Lakeville,41.946073,-73.444406,daycare
Extras,Salisbury,41.97067792,-73.43643373,daycare
Housatonic Day Care,Salisbury,41.97315165,-73.40911374,daycare
Little Scholar School,Lakeville,41.962607,-73.439397,daycare
Beginning Years Childrens Center,Sharon,41.879472,-73.4799,daycare
Sharon Day Care Center Inc. Po Box,Sharon,41.876291,-73.477088,daycare
Warren Church Community Childcare,Cornwall bridge,41.743965,-73.348804,daycare
Comm Org & Oper Latch Key (cool),Andover,41.72843934,-72.36873426,daycare
Indian Valley Ymca Ashford Saccp,Ashford,41.891035,-72.169711,daycare
Kidderbrook Montessori School,Ashford,41.916244,-72.211107,daycare
Apple Tree Children's Center,Avon,41.811381,-72.865081,daycare
Avon Congregational Church Nursery,Avon,41.809821,-72.831031,daycare
Christ Church Nursery School,Avon,41.7668,-72.858972,daycare
Churchery School,Avon,41.76568,-72.870521,daycare
Educational Playcare Ltd,Avon,41.819996,-72.829271,daycare
Educational Playcare Ltd.,Avon,41.818261,-72.829832,daycare
Pine Grove Fun Co.,Avon,41.77679,-72.854522,daycare
Pine Grove Nursery School,Avon,41.79025,-72.860291,daycare
Pooh's Corner Inc.,Avon,41.814111,-72.866761,daycare
The Farmington Academy Inc.,Bristol,41.81733324,-72.83385252,daycare
Wish Upon A Star,Avon,41.80026,-72.819222,daycare
Barkhamsted School Age Child Care,Pleasant valley,41.91110674,-72.98983552,daycare
Bethlehem Day Care Inc.,Bethlehem,41.65132,-73.202582,daycare
Bethel Day Care Center,Bloomfield,41.83702,-72.699342,daycare
Bloomfield Early Learning Center,Bloomfield,41.819827,-72.700115,daycare
Bloomfield Working Parents Child Care,Bloomfield,41.822607,-72.712846,daycare
Bright Horizons Family Solution @,Bloomfield,41.81058,-72.749096,daycare
Crt Eric D. Coleman E.c.e. Center,Bloomfield,41.82321,-72.696262,daycare
First Cong Church Nursery School,Bloomfield,41.831881,-72.736611,daycare
Kiddie Academy Of Bloomfield,Bloomfield,41.835066,-72.737459,daycare
Kids' Place Inc.,Bloomfield,41.818291,-72.724961,daycare
Bolton Cooperative Nursery Inc,Bolton,41.769511,-72.432939,daycare
Hans Christian Andersen Montessori,Bolton,41.77078,-72.435036,daycare
Yw Kidslink In Bolton,Bolton,41.776607,-72.442755,daycare
A Place To Grow Too,Bristol,41.648909,-72.907597,daycare
Bco/bristol Head Start,Bristol,41.658839,-72.922899,daycare
Bingham Fun Club,Bristol,41.681648,-72.949101,daycare
Bristol Boys & Girls Club Assoc./pleasant,Bristol,41.670136,-72.945637,daycare
Bristol Boys/girls Club Assn./laurel St.,Bristol,41.672835,-72.947801,daycare
Bristol Boys/girls Club Assoc./d. Beals,Bristol,41.683737,-72.903295,daycare
Bristol Head Start,Bristol,41.667801,-72.946321,daycare
Bristol Hospital Child Development Center,Bristol,41.680288,-72.947117,daycare
Bristol Preschool Child Care Center Inc.,Bristol,41.670421,-72.944394,daycare
Carrier Learning Center Llc,Bristol,41.697229,-72.904248,daycare
Century Nursery School,Bristol,41.677626,-72.940877,daycare
Christian Nursery School,Bristol,41.687981,-72.925252,daycare
Edgewood Fun Club,Bristol,41.70115,-72.922159,daycare
Family Center For Girls And Boys,Bristol,41.669099,-72.946793,daycare
Greene Hills Fun Club,Bristol,41.668886,-72.8968,daycare
Hubbell Fun Club,Bristol,41.677526,-72.908713,daycare
Ivy Drive Fun Club,Bristol,41.705841,-72.901161,daycare
Jennings Fun Club,Bristol,41.690202,-72.943555,daycare
Liberty Baptist Child Care Center,Bristol,41.704958,-72.937275,daycare
Mt. View Fun Club,Bristol,41.694424,-72.898706,daycare
Queen Of Apostles Montessori Education,Bristol,41.66439,-72.931869,daycare
South Side Fun Club,Bristol,41.666794,-72.936255,daycare
Stafford Fun Club,Bristol,41.689167,-72.91773,daycare
Whiz Kids Child Development Center,Bristol,41.653531,-72.897823,daycare
Carelot Children's Center Inc.- Brooklyn,Brooklyn,41.799577,-71.897149,daycare
Tvcca Brooklyn-killingly Early Childhood,Brooklyn,41.799415,-71.888024,daycare
Burlington Academy Of Learning,Burlington,41.768197,-72.961938,daycare
Burlington Academy Of Learning,Burlington,41.769352,-72.962008,daycare
Joni's Child Care And Pre-school,Burlington,41.77116,-72.971672,daycare
Kordas Korner Llc Preschool,Burlington,41.769021,-72.966741,daycare
Lake Garda Fun Club,Burlington,41.74252,-72.907461,daycare
Young Beginnings Children's Center Inc. I,Burlington,41.769084,-72.96633,daycare
Young Beginnings Children's Center Inc. Ii,Burlington,41.769031,-72.966921,daycare
Canaan Child Care Center,Canaan,42.033215,-73.330184,daycare
Canterbury Children's Academy Inc.,Canterbury,41.705218,-71.988186,daycare
Canton Community Nursery School,North canton,41.892481,-72.892802,daycare
Canton Community Nursery School,Canton,41.824441,-72.896852,daycare
Joni's Child Care,Canton,41.831841,-72.913142,daycare
Kindercare Learning Center,Canton,41.82448,-72.895822,daycare
Stepping Stones Education Center,Canton,41.832308,-72.917547,daycare
Trinity Episcopal Nursery School,Collinsville,41.811383,-72.923047,daycare
Carelot Children's Center,Chaplin,41.755045,-72.149675,daycare
Colebrook Child Care Llc,Colebrook,41.97124,-73.04744,daycare
Coventry Early Childhood Center Inc.,Coventry,41.768053,-72.300583,daycare
Apple Tree Children's Center,East granby,41.940515,-72.72482,daycare
Kindercare Learning Center,East granby,41.929171,-72.714332,daycare
Martin Group Day Care Home,East granby,41.953931,-72.772272,daycare
Ymca Allgrove School Fun Company,East granby,41.94418,-72.731782,daycare
Happy Hours Nursery & Day Care Center Inc.,East hartford,41.761251,-72.637791,daycare
Silva's Youth Of Today Learning Center Llc,East hartford,41.763671,-72.615121,daycare
South Congregational Church Nursery,East hartford,41.736991,-72.605101,daycare
Ymca Child Care Center,East hartford,41.736301,-72.615063,daycare
Ymca First Church,East hartford,41.7691,-72.643941,daycare
Ymca Larson Center,East hartford,41.77874,-72.592962,daycare
Ymca Magnet School,East hartford,41.735084,-72.590548,daycare
Ymca O'brien School,East hartford,41.792892,-72.610358,daycare
Ywca East Hartford Early Learning Center,East hartford,41.77628,-72.628362,daycare
Work And Play School,East windsor,41.89346,-72.604421,daycare
Grammy's Garden,East windsor,41.908701,-72.613157,daycare
Growing Tree Child Development Center,East windsor,41.89866,-72.581011,daycare
Children's Choice Learning Ctr Of,Ellington,41.90108,-72.460877,daycare
Ellington Christian Nursery School,Ellington,41.911384,-72.44913,daycare
Little Nursery School,Ellington,41.875668,-72.457753,daycare
Preschool Of The Arts Inc.,Ellington,41.904283,-72.469031,daycare
Scotty's Kiddy Korner Preschool &,Ellington,41.877921,-72.463825,daycare
Ymca Ellington Latch Key Program,Ellington,41.902638,-72.464405,daycare
Country Day School - Annex,Enfield,41.994851,-72.594291,daycare
Apple Tree Learning Center,Enfield,41.9981,-72.580996,daycare
Bright Horizons Family Solutions,Enfield,41.96931,-72.565132,daycare
Calvary Christian Childhood Center,Enfield,41.959966,-72.597917,daycare
Country Day School - Main Bldg.,Enfield,41.994851,-72.594291,daycare
Happy Time Preschool Llc,Enfield,41.960612,-72.575457,daycare
Hazardville Day Care Center Llc,Enfield,41.986171,-72.536071,daycare
Here Wee Grow,Enfield,41.98617,-72.537853,daycare
Kids Kare Child Care,Enfield,41.985581,-72.510052,daycare
Kids Kare Child Care & Learning Ctr Llc,Enfield,41.95939,-72.598641,daycare
Milestones Child Care & Learning Center,Enfield,41.999951,-72.594122,daycare
New England Preschool Academy Inc.,Enfield,41.960001,-72.574721,daycare
New England Preschool Academy Inc.,Enfield,42.003061,-72.592932,daycare
Our Redeemer Nursery School,Enfield,41.990216,-72.541202,daycare
This Is The Way..learning Center,Enfield,42.002071,-72.563941,daycare
Town Of Enfield Child Development Center,Enfield,41.996815,-72.597077,daycare
Town Of Enfield Child Development Center,Enfield,41.976952,-72.569405,daycare
Creative Child Center,Farmington,41.735778,-72.795135,daycare
Educational Playcare,Farmington,41.711948,-72.807718,daycare
